date,ticker,title,source,url,full_content,query_source,signal_score,is_atw_core,scraping_date
2025-10-24T19:04:44+00:00,ATW,L’Académie des Arts célèbre sa première promotion à Rabat et Tanger : une dynamique nationale pour révéler les talents et renforcer l’égalité des chances,Aujourd'hui,https://aujourdhui.ma/culture/lacademie-des-arts-celebre-sa-premiere-promotion-a-rabat-et-tanger-une-dynamique-nationale-pour-reveler-les-talents-et-renforcer-legalite-des-chances,"La Fondation Al Mada a célébré cette semaine, à Rabat et Tanger, la première promotion du programme Académie des Arts, marquant une nouvelle étape dans son engagement pour une jeunesse marocaine créative, épanouie et actrice de son avenir. Déployée en partenariat avec le Ministère de l’Éducation nationale et les Académies Régionales de Rabat et Tanger, l’initiative est portée par la Fondation Al Mada, avec le soutien opérationnel des programmes ESG/RSE des filiales du Groupe (Attijariwafa bank, Inwi, Managem, Nareva, Marjane). Elle s’inscrit dans une ambition commune : élargir l’accès des jeunes à la culture, à la création et à la réussite. Un programme national pour révéler les jeunes talents, au-delà de la capitale économique Lancé initialement à Casablanca, le programme Académie des Arts a franchi en 2024 un cap décisif avec l’ouverture de deux nouveaux centres pilotes à Rabat et Tanger, touchant près de 300 jeunes âgés de 15 à 21 ans, issus pour une large part de quartiers populaires et de milieux sous-représentés dans les filières artistiques. Pendant un an, ces jeunes ont bénéficié d’une formation gratuite et exigeante, mêlant arts plastiques, création numérique, masterclasses avec des artistes marocains de renom, et sorties culturelles pour élargir leurs références. Porté par la pédagogie du Learning by Doing, le dispositif conjugue exigence artistique, accompagnement humain et inclusion sociale. « Grâce à l’Académie, j’ai découvert que l’art pouvait être un métier, pas seulement une passion. Aujourd’hui, je veux devenir illustrateur professionnel », Rayane, 18 ans, lauréat de la promotion Rabat. Deux cérémonies célébrant l’effort, la créativité et la promesse d’un avenir Les cérémonies de Rabat et Tanger, organisées respectivement les 15 et 17 octobre, ont permis de valoriser le travail accompli par les élèves. Allocutions officielles, témoignages, performances, et expositions ont illustré leur progression artistique, leur confiance retrouvée, et l’espoir que ce programme fait naître. Des certificats de participation ont été remis aux lauréats, non comme des fins en soi, mais comme le point de départ d’un parcours d’émancipation par la culture et l’expression artistique. Une montée en puissance : Marrakech, Laâyoune et Sefrou en 2026 Fort de ce succès, le programme entame une nouvelle phase d’expansion, avec l’ouverture annoncée de trois centres supplémentaires à Marrakech, Laâyoune et Sefrou. Chaque implantation répond à une logique d’équilibre territorial, de renforcement des capacités locales, et de soutien à l’insertion des jeunes par des voies nouvelles et valorisantes. Une mission culturelle ancrée dans une ambition sociétale nationale Pour la Fondation Al Mada, l’éducation artistique est un levier essentiel pour réduire les inégalités d’accès à la culture, révéler les talents et nourrir l’expression des jeunes. À travers ce programme, le Groupe Al Mada affirme sa volonté de faire de la culture un moteur d’épanouissement, de cohésion sociale et de fierté partagée. À propos de l’Académie des Arts Créée en 2009 par la Fondation Attijariwafa bank, sous l’égide de la Fondation Al Mada, l’Académie des Arts est un programme national d’éducation artistique gratuite, structuré autour de l’apprentissage par la pratique, l’accompagnement professionnel et l’ouverture culturelle. Plus de 2 000 jeunes ont déjà été formés depuis sa création. À propos de la Fondation Al Mada La Fondation Al Mada place la culture, l’éducation et la jeunesse au cœur de sa mission d’intérêt général. Elle agit comme un catalyseur d’initiatives citoyennes, en synergie avec les territoires et les écosystèmes éducatifs, pour construire une société plus juste, plus créative et plus inclusive. Recevez les dernières actualités d’Aujourd’hui Le Maroc directement sur WhatsApp",direct:aujourdhui_search,36,0,2026-04-17T19:20:46.429608+00:00
2025-10-23T18:19:35+00:00,ATW,Attijariwafa bank : un parcours boursier toujours porteur,Medias24,https://medias24.com/2025/10/23/attijariwafa-bank-un-parcours-boursier-toujours-porteur/,,direct:medias24_wp,67,1,2026-04-17T19:21:47.841440+00:00
2025-10-15T10:34:53+00:00,ATW,Bourse : Légère baisse de la confiance des investisseurs en octobre,Aujourd'hui,https://aujourdhui.ma/economie/bourse-legere-baisse-de-la-confiance-des-investisseurs-en-octobre,"AGR : L’Indice de confiance des investisseurs en Bourse, élaboré par Attijari Global Research (AGR), s’est établi à 61,6 points (pts) en octobre 2025, affichant un repli de 1,5 point par rapport à l’édition précédente. Cette baisse s’explique principalement par le changement de perception des investisseurs étrangers, indique la filiale d’Attijariwafa bank dans son «Research Report – Strategy» consacré à l’AGR Indice de Confiance. Néanmoins, l’indice se maintient au milieu de la phase dite d’«Assurance» depuis plus de 2 ans, traduisant une perception toujours «sereine» du marché Actions pour les trois prochains mois. Par catégorie d’investisseurs, l’indice des Étrangers a reculé de 17,9 pts, à 47,5 pts, basculant de la phase d’«Assurance» à celle d’«Attentisme», fait savoir la même source. À l’inverse, les investisseurs locaux, représentant 89% du marché, affichent des scores globalement positifs, contre une appréciation soutenue de 4,3 pts, à 68,4 pts pour les Particuliers, une hausse de 3,5 pts, à 67,2 pts pour les Acteurs de Référence et une stabilité à 61,5 pts pour les Institutionnels et Organismes de placement collectif en valeurs mobilières (OPCVM) locaux. Selon AGR, 57% des investisseurs sondés anticipent une hausse de l’indice MASI au cours des trois prochains mois, tandis que 38% prévoient une amélioration des volumes échangés. Recevez les dernières actualités d’Aujourd’hui Le Maroc directement sur WhatsApp",direct:aujourdhui_search,62,1,2026-04-17T19:20:46.429608+00:00
2025-10-07T09:25:24+00:00,ATW,La Fondation Al Mada et l’INPT lancent à Rabat un Master Data & IA,Aujourd'hui,https://aujourdhui.ma/actualite/la-fondation-al-mada-et-linpt-lancent-a-rabat-un-master-data-ia,"Il est unique au Maroc et combine formation académique et expérience professionnelle Programme : La Fondation Al Mada et l’Institut national des postes et télécommunications (INPT) ont lancé, lundi à Rabat, un Master Data & IA, unique au Maroc, qui combine formation académique et expérience professionnelle en alternance rémunérée, en présence d’un parterre d’étudiants et de l’ensemble des parties prenantes du programme. D’une durée de deux ans, ce Master s’adresse aux titulaires d’une licence en mathématiques, informatique ou physique et s’articule autour d’une première année de tronc commun, suivie d’une deuxième année de spécialisation. Ce programme se distingue par une spécificité unique au Maroc : un parcours en alternance rémunérée, alliant formation académique et expérience en entreprise sur toute la durée des deux années. Il ambitionne de former une nouvelle génération de talents hautement qualifiés, capables d’accompagner et de stimuler les transitions numériques et technologiques du Royaume. La première promotion, composée de 30 étudiants retenus à l’issue d’un processus de sélection rigoureux, fondé sur l’examen du dossier académique, un concours écrit et des épreuves orales, a entamé les cours le 22 septembre dernier, alors que la première immersion en entreprise est prévue dès janvier 2026. Cette expérience pilote qui a vocation à se développer permettra, dans les prochaines années, de former un nombre croissant d’étudiants. Quatre entreprises de référence accompagnent cet ambitieux programme, à savoir Attijariwafa bank, inwi, Managem et Marjane Group, qui accueilleront les étudiants pendant des périodes prédéterminées et les accompagneront avec l’INPT tout au long du cursus. La formation, prise en charge par la Fondation Al Mada et ses partenaires, est prodiguée par des enseignants-chercheurs et des professionnels expérimentés. Elle intègre des cas pratiques issus des entreprises partenaires et accorde une place centrale aux soft skills, afin de préparer les étudiants à devenir des acteurs clés de la transformation digitale nationale Dans un contexte où la data et l’intelligence artificielle redéfinissent les modèles économiques et les compétences clés des entreprises, le Master Data & IA ambitionne de former des data scientists et data engineers alliant expertise technique, vision stratégique et responsabilité numérique. À travers ce programme, la Fondation Al Mada réaffirme donc son engagement en faveur du «Positive Impact», en soutenant une éducation de qualité, résolument orientée vers les métiers d’avenir et en adéquation avec les besoins réels du marché. De son côté, l’INPT confirme sa position d’acteur de référence nationale dans la formation d’excellence au service de la transformation digitale du Maroc. Arès avoir mis en avant la conviction forte derrière la création de ce master, le président de la Fondation Al Mada, Hassan Ouriagli, a estimé que «l’avenir de nos économies, de nos entreprises et de nos sociétés se jouera dans la maîtrise et l’usage responsable des données et de l’IA». «Nous sommes à un moment charnière où ces technologies ne sont plus une option, mais un impératif stratégique», a souligné M. Ouriagli, affirmant à travers ce programme, la volonté d’investir dans le capital humain, de préparer une nouvelle génération de talents capables non seulement de manier des outils technologiques de pointe, mais aussi d’en comprendre les implications éthiques, économiques et sociales. Il a, en outre, exprimé le vœu que ce master soit non seulement un lieu de formation académique, mais aussi un laboratoire d’idées, d’innovation et de coopération entre le monde académique et le monde économique, au service de notre pays et du continent. «Ce Master illustre pleinement notre mission : former des profils hautement qualifiés, capables de répondre aux grands défis de la transformation numérique et technologique du Royaume», a indiqué, pour sa part, le directeur par intérim de l’INPT, Ahmed Tamtaoui. Grâce à ce partenariat avec la Fondation Al Mada, a-t-il soutenu, «nous offrons à nos étudiants une formation de pointe, conjuguant rigueur académique et expérience professionnelle, afin de préparer les talents dont le Maroc a besoin pour son avenir». Recevez les dernières actualités d’Aujourd’hui Le Maroc directement sur WhatsApp",direct:aujourdhui_search,60,1,2026-04-17T19:20:46.429608+00:00
2025-09-23T13:16:39+00:00,ATW,Le patron de Sintram condamné à 100 MDH au profit d'Attijariwafa bank,Medias24,https://medias24.com/2025/09/23/le-patron-de-sintram-condamne-a-100-mdh-au-profit-dattijariwafa-bank/,,direct:medias24_wp,69,1,2026-04-17T19:21:47.841440+00:00
2025-09-15,ATW,"Attijariwafa bank: Toujours à l’achat, BKGR relève son objectif de cours à 900 DH",Boursenews,https://boursenews.ma/article/marches/atw-bkgr-releve-son-objectif-de-cours-recommandation,,direct:boursenews_stock,69,1,2026-04-17T19:21:08.394039+00:00
2025-09-09T12:49:35+00:00,ATW,Casa Parc : AWB enclenche la vente judiciaire d’un terrain de 12 hectares,Medias24,https://medias24.com/2025/09/09/casa-parc-awb-enclenche-la-vente-judiciaire-dun-terrain-de-12-hectares/,,direct:medias24_wp,44,0,2026-04-17T19:21:47.841440+00:00
2025-08-05T09:08:21+00:00,ATW,Attijariwafa bank :Un produit net bancaire de plus  de 17 MMDH au 1er semestre,Aujourd'hui,https://aujourdhui.ma/economie/attijariwafa-bank-un-produit-net-bancaire-de-plus-de-17-mmdh-au-1er-semestre,"Attijariwafa bank réalise de bonnes performances au premier semestre de l’année. Le groupe bancaire voit ses résultats en forte croissance. On relève un produit net bancaire consolidé de l’ordre de 17,7 milliards DH en hausse de 4 % comparé à la même période de l’année précédente. Une progression induite, selon Attijariwafa bank, par une dynamique commerciale favorable. Le résultat brut d’exploitation a pour sa part progressé de 4,2 % pour atteindre les 11,4 milliards DH. Une performance qui s’accompagne par une amélioration de 20 points de base du coefficient d’exploitation s’établissant à 35,3 % sur base consolidée, soit un gain de 12 points comparé à juin 2019. On relève également une hausse de 14,5 % du résultat d’exploitation. Il s’est établi à 10 milliards DH. Le résultat net s’est pour sa part élevé à 6,9 milliards DH contre 5,8 milliards DH en hausse de 19,6 %. Le résultat net part du groupe ressort quant à lui à 5,9 milliards DH contre 4,9 milliards DH la même période de l’année précédente. Recevez les dernières actualités d’Aujourd’hui Le Maroc directement sur WhatsApp",direct:aujourdhui_search,83,1,2026-04-17T19:20:46.429608+00:00
2025-07-29,ATW,"Attijariwafa bank SA Reports Earnings Results for the Half Year Ended June 30, 2025",MarketScreener,https://www.marketscreener.com/news/attijariwafa-bank-sa-reports-earnings-results-for-the-half-year-ended-june-30-2025-ce7c5fdfde80f62d,,direct:marketscreener_atw_news,69,1,2026-04-17T19:21:39.047206+00:00
2025-07-24T09:13:23+00:00,ATW,Open Innovation Attijariwafa bank lance  «Open Start by Wenov»,Aujourd'hui,https://aujourdhui.ma/economie/open-innovation-attijariwafa-bank-lance-open-start-by-wenov,"Attijariwafa bank lance son programme d’Open Innovation sous le thème de l’intelligence artificielle. Baptisée «Open Start by Wenov», cette initiative menée par l’entité du groupe bancaire dédiée à l’innovation «Wenov» vise à renforcer la dynamique d’innovation ouverte du Groupe en collaboration avec des startups à fort potentiel. «En lançant cette nouvelle édition, Attijariwafa bank réaffirme son engagement à stimuler l’innovation collaborative, à renforcer les synergies avec l’écosystème entrepreneurial et à faire de l’intelligence artificielle un levier de transformation durable», indique le Groupe à ce propos. Pour cette année, Attijariwafa bank s’associe à deux incubateurs de renom pour accompagner les startups tout au long du programme. Citons dans ce sens le CEED Maroc qui sera en charge de 11 challenges identifiés au niveau de la banque et ses filiales de financement spécialisées au Maroc ainsi que de OST International qui accompagnera 4 challenges portés par les filiales à l’international du Groupe. Il est à noter que Open Start by Wenov repose sur une approche tripartite réunissant des startups matures sélectionnées pour leur capacité d’innovation, les experts métiers et techniques d’Attijariwafa bank et les organismes accompagnateurs CEED Maroc et OST International. La finalité étant de co-construire de Proofs of Concept (POC) autour de thématiques stratégiques pour le Groupe. Recevez les dernières actualités d’Aujourd’hui Le Maroc directement sur WhatsApp",direct:aujourdhui_search,59,0,2026-04-17T19:20:46.429608+00:00
2025-07-21T10:02:12+00:00,ATW,Bourse de Casablanca : Deux records historiques  à la clôture de la semaine  du 14 au 18 juillet,Aujourd'hui,https://aujourdhui.ma/economie/bourse-de-casablanca-deux-records-historiques-a-la-cloture-de-la-semaine-du-14-au-18-juillet,"Performance : La Bourse de Casablanca a terminé la semaine du 14 au 18 juillet sur deux records historiques, avec un MASI (Moroccan All Shares Index) au-delà des 19.000 points et une capitalisation dépassant les 1.000 MMDH. Dans les détails, le MASI a progressé de 0,9%, à 19.168,83 points , portant sa performance annuelle à 29,75%. Le MASI.20, qui reflète la performance des 20 entreprises les plus liquides, a augmenté de 0,99%, à 1.578,22 points, et le MASI.ESG, indice des entreprises les mieux notées en matière ESG selon Moody’s ESG Solutions, a avancé de 0,13% à 1.318,74 points. De son côté, le MASI Mid and Small Cap, qui calcule la performance des petites et moyennes capitalisations, a gagné 0,66%, à 1.819,1points. Ce mouvement haussier trouve son origine principalement dans les secteurs «Industrie pharmaceutique» (+9,64%), «Électricité» (+3,32%) et «Mines» (+2,94%). En revanche, les indices « Ingénieries et biens d’équipement industriels» (-7,21%), «Sylviculture et papier» (-6,46%) et «Transport» (-2,96%). Les échanges ont culminé à près de 15 MMDH, répartis sur les apports de titres (plus de 12,1 MMDH), le marché central (2,12 MMDH), les introductions (500 millions de dirhams – MDH), le marché de blocs (129,28 MDH) et les transferts (15,75 MDH). En tête des instruments les plus actifs cette semaine figurent Label’Vie avec une part de 20,26%, Taqa Morocco (9,95%) et TGCC (9,35%). Quant à la capitalisation boursière, elle s’est chiffrée à plus de 1.007 MMDH, dominée par Attijariwafa bank (15,48%), Itissalat Al-Maghrib (10,55%) et Taqa Morocco (6,99%). Recevez les dernières actualités d’Aujourd’hui Le Maroc directement sur WhatsApp",direct:aujourdhui_search,78,1,2026-04-17T19:20:46.429608+00:00
2025-07-10T09:47:32+00:00,ATW,Transfert des eaux dessalées : Une convention stratégique entre Casablanca-Settat et Marrakech-Safi,Aujourd'hui,https://aujourdhui.ma/actualite/transfert-des-eaux-dessalees-une-convention-strategique-entre-casablanca-settat-et-marrakech-safi,"Doté d’un budget de plus de 6 milliards de dirhams, ce projet stratégique vise à renforcer durablement l’approvisionnement en eau potable dans plusieurs provinces de la région. Le conseil de la région Marrakech-Safi, réuni en début de semaine, a approuvé une convention de partenariat entre l’État et les régions de Casablanca-Settat et Marrakech-Safi, portant sur la création et l’exploitation de canalisations destinées au transfert des eaux dessalées depuis les stations de dessalement situées à Casablanca et Safi. Ce partenariat s’inscrit dans le cadre d’un protocole d’accord, conclu entre l’État, les deux régions concernées, les Sociétés régionales multiservices de Casablanca-Settat et de Marrakech-Safi, ainsi que le Groupe Attijariwafa bank, pour un montant global dépassant les 6 milliards de dirhams , répartis entre les deux régions. Le conseil a également approuvé à l’unanimité plusieurs conventions de partenariat relatives à la régularisation foncière, l’exploitation et la gestion de projets d’alimentation en eau potable au niveau de plusieurs centres relevant de la préfecture de Marrakech et des provinces d’El Kelaâ des Sraghna, Youssoufia, Safi, Rehamna et Essaouira. Les membres du conseil ont, par ailleurs, validé une convention de partenariat entre l’État, les régions de Rabat-Salé-Kénitra, Casablanca-Settat et Marrakech-Safi, et l’Office national des chemins de fer (ONCF), relative au projet d’extension de la ligne de train à grande vitesse entre Kénitra et Marrakech, outre le développement d’un réseau de trains régionaux express (RER) dans les zones urbaines et périurbaines de la région. Ce projet découle d’un protocole d’accord réunissant l’État, les trois régions, l’ONCF, Attijariwafa bank, la Banque Centrale Populaire (BCP), Bank of Africa, le Crédit du Maroc et la Caisse de dépôt et de gestion (CDG), pour un budget global estimé à 16 MMDH, représentant la contribution de la région à ce projet. Les travaux de cette session ont été marqués par la présentation d’un exposé détaillé sur le contrat liant l’État et la région Marrakech-Safi pour la période 2024-2027, mobilisant une enveloppe budgétaire de près de 9,2 MMDH pour la réalisation de 55 projets stratégiques répartis autour de cinq axes prioritaires, dans le cadre de la mise en œuvre du programme de développement régional 2022-2027. Recevez les dernières actualités d’Aujourd’hui Le Maroc directement sur WhatsApp",direct:aujourdhui_search,36,0,2026-04-17T19:20:46.429608+00:00
2025-07-09T10:35:43+00:00,ATW,LGV Marrakech-Kénitra : Le conseil de la région Casablanca-Settat valide le protocole de financement,Aujourd'hui,https://aujourdhui.ma/economie/lgv-marrakech-kenitra-le-conseil-de-la-region-casablanca-settat-valide-le-protocole-de-financement,"Le Conseil de la région Casablanca-Settat, réuni lundi au titre de la session de juillet, a approuvé le projet de protocole de financement du projet de Ligne à grande vitesse (LGV) Marrakech-Kénitra. La convention est conclue par le ministère de l’intérieur, le ministère du transport et de la logistique, le ministère de l’économie et des finances, la wilaya de la région Casablanca-Settat, le conseil de la région Casablanca-Settat, le conseil de la région Rabat-Salé-Kénitra, le conseil de la région Marrakech-Safi, l’ONCF, Attijariwafa bank, la Banque Populaire, la Caisse de dépôt et de gestion (CDG), Bank of Africa et Crédit du Maroc. Ce projet structurant, d’une enveloppe de 53 milliards de dirhams (hors matériel roulant), fait partie d’un programme ambitieux mobilisant un investissement global de 96 MMDH qui porte également sur l’acquisition de 168 trains pour un montant de 29 milliards DH, destinés au renouvellement du parc existant de l’Office national des chemins de fer (ONCF) et l’accompagnement des projets de développement, ainsi que le maintien de la performance pour 14 milliards DH, permettant notamment le développement de 3 réseaux de transport métropolitain au niveau des agglomérations de Casablanca, Rabat et Marrakech. Il est à noter que la réunion du conseil de la région Casablanca-Settat, présidée par le wali de la région Mohamed Mhidia et le président du Conseil de la région Abdellatif Maâzouz, a été marquée par l’approbation de l’ensemble des points inscrits à l’ordre du jour, dont plusieurs autres conventions de partenariat dans les domaines économique, social, culturel et environnemental. Recevez les dernières actualités d’Aujourd’hui Le Maroc directement sur WhatsApp",direct:aujourdhui_search,44,0,2026-04-17T19:20:46.429608+00:00
2025-06-18T12:09:59+00:00,ATW,Trophées Ana Maak : une 4ᵉ édition record pour célébrer l’esprit entrepreneurial marocain,Medias24,https://medias24.com/2025/06/18/trophees-ana-maak-une-4%e1%b5%89-edition-record-pour-celebrer-lesprit-entrepreneurial-marocain/,,direct:medias24_wp,36,0,2026-04-17T19:21:47.841440+00:00
2025-06-17T17:21:03+00:00,ATW,"Bourse de Casablanca. Le MASI recule de 0,55%, mais reste au-dessus des 18.000 points",Medias24,https://medias24.com/2025/06/17/bourse-de-casablanca-le-masi-recule-de-055-mais-reste-au-dessus-des-18-000-points/,,direct:medias24_wp,42,0,2026-04-17T19:21:47.841440+00:00
2025-06-17T17:15:25+00:00,ATW,"Visa de l’AMMC : Attijariwafa bank lance une émission obligataire subordonnée de 1,5 MMDH",Medias24,https://medias24.com/2025/06/17/visa-de-lammc-attijariwafa-bank-lance-une-emission-obligataire-subordonnee-de-15-mmdh/,,direct:medias24_wp,51,0,2026-04-17T19:21:47.841440+00:00
2025-06-17,ATW,"Attijariwafa Bank : L'AMMC vise le prospectus relatif à l'émission d'un emprunt obligataire subordonné de 1,5 milliard de dirhams",Boursenews,https://boursenews.ma/article/marches/ATW-AMMC-vise-le-prospectus-relatif-a-l-emission-d-un-emprunt-obligataire,,direct:boursenews_stock,51,0,2026-04-17T19:21:08.394039+00:00
2025-06-16T13:55:52+00:00,ATW,"L'entreprise Oulad Zerrad en redressement : AWB et SGMB valident leurs créances, BoA en attente",Medias24,https://medias24.com/2025/06/16/lentreprise-oulad-zerrad-en-redressement-awb-et-sgmb-valident-leurs-creances-boa-en-attente/,,direct:medias24_wp,16,0,2026-04-17T19:21:47.841440+00:00
2025-06-16,ATW,Morocco's Wafa Assurance to take over Egypt's Delta Insurance,MarketScreener,https://www.marketscreener.com/news/latest/Morocco-s-Wafa-Assurance-to-take-over-Egypt-s-Delta-Insurance-50251125/,,direct:marketscreener_atw_news,16,0,2026-04-17T19:21:39.047206+00:00
2025-06-15,ATW,Attijariwafa Bank : Mise à jour annuelle du dossier d’information relatif au programme d'émission de certificats de dépôt,MarketScreener,https://www.marketscreener.com/quote/stock/ATTIJARIWAFA-BANK-SA-41148801/news/Attijariwafa-Bank-Mise-a-jour-annuelle-du-dossier-d-information-relatif-au-programme-d-emissio-50324550/,,direct:marketscreener_atw_news,51,0,2026-04-17T19:21:39.047206+00:00
2025-06-15,ATW,Attijariwafa Bank : L’AMMC vise le prospectus relatif à l’émission d’un emprunt obligataire subordonné,MarketScreener,https://www.marketscreener.com/quote/stock/ATTIJARIWAFA-BANK-SA-41148801/news/Attijariwafa-Bank-L-AMMC-vise-le-prospectus-relatif-a-l-emission-d-un-emprunt-obligataire-50324548/,,direct:marketscreener_atw_news,51,0,2026-04-17T19:21:39.047206+00:00
