date,ticker,title,source,url,full_content,query_source,signal_score,is_atw_core,scraping_date
2026-04-16T19:52:45+00:00,ATW,Dialogue social: La CGEM exclut toute hausse du Smig,L'Economiste,https://www.leconomiste.com/dialogue-social-la-cgem-exclut-toute-hausse-du-smig/,,direct:leconomiste_wp,16,0,2026-04-17T19:21:26.874410+00:00
2026-04-16T19:48:56+00:00,ATW,"CGEM 2020-2026: Six ans de crise, quelques réformes, beaucoup de chantiers",L'Economiste,https://www.leconomiste.com/cgem-2020-2026-six-ans-de-crise-quelques-reformes-beaucoup-de-chantiers/,,direct:leconomiste_wp,16,0,2026-04-17T19:21:26.874410+00:00
2026-04-16T19:44:06+00:00,ATW,Dialogue social: Ce que l’UMT met sur la table,L'Economiste,https://www.leconomiste.com/dialogue-social-ce-que-lumt-met-sur-la-table/,,direct:leconomiste_wp,16,0,2026-04-17T19:21:26.874410+00:00
2026-04-16T19:41:07+00:00,ATW,«Le Smig ne permet plus de couvrir que 5 jours»,L'Economiste,https://www.leconomiste.com/le-smig-ne-permet-plus-de-couvrir-que-5-jours/,,direct:leconomiste_wp,16,0,2026-04-17T19:21:26.874410+00:00
2026-04-16T19:37:18+00:00,ATW,Conjoncture: La croissance à 5% au 1er trimestre,L'Economiste,https://www.leconomiste.com/conjoncture-la-croissance-a-5-au-1er-trimestre/,,direct:leconomiste_wp,34,0,2026-04-17T19:21:26.874410+00:00
2026-04-16T19:34:11+00:00,ATW,Assurance: Comment conquérir de nouvelles niches,L'Economiste,https://www.leconomiste.com/assurance-comment-conquerir-de-nouvelles-niches/,,direct:leconomiste_wp,16,0,2026-04-17T19:21:26.874410+00:00
2026-04-16T19:28:31+00:00,ATW,"Assurance: Anticiper les mutations, investir l’IA, protéger les assurés…",L'Economiste,https://www.leconomiste.com/assurance-anticiper-les-mutations-investir-lia-proteger-les-assures/,,direct:leconomiste_wp,16,0,2026-04-17T19:21:26.874410+00:00
2026-04-16T19:18:16+00:00,ATW,Investissement public: Les scénarios du FMI,L'Economiste,https://www.leconomiste.com/investissement-public-les-scenarios-du-fmi/,,direct:leconomiste_wp,16,0,2026-04-17T19:21:26.874410+00:00
2026-04-16T19:08:14+00:00,ATW,Profession d’avocat: Le marathon parlementaire démarre,L'Economiste,https://www.leconomiste.com/profession-davocat-le-marathon-parlementaire-demarre/,,direct:leconomiste_wp,16,0,2026-04-17T19:21:26.874410+00:00
2026-04-16T19:04:13+00:00,ATW,EasyJet mise gros sur le Maroc,L'Economiste,https://www.leconomiste.com/easyjet-mise-gros-sur-le-maroc/,,direct:leconomiste_wp,16,0,2026-04-17T19:21:26.874410+00:00
2026-04-16T09:26:03+00:00,ATW,En vue de booster les exportations et l’investissement africain : Trois conventions signées en marge  du ZLECAf Trade Finance Summit,Aujourd'hui,https://aujourdhui.ma/economie/en-vue-de-booster-les-exportations-et-linvestissement-africain-trois-conventions-signees-en-marge-du-zlecaf-trade-finance-summit,"Cette rencontre a été marquée par l’organisation de deux panels de haut niveau. Commerce intra-africain : Près de 300 exportateurs ont pris part au ZLECAf Trade Finance Summit pour débattre des avancées concrètes de la Zone ainsi que sur des mécanismes de financement, de sécurisation des exportations et de dynamisation du commerce intra-africain. Trois conventions de partenariat destinées à accompagner les entreprises et à stimuler les investissements ont été signées en marge du ZLECAf Trade Finance Summit. Cet événement, tenu mardi à Casablanca sous l’initiative de la Confédération marocaine des exportateurs (Asmex) et le Club Afrique Développement(CAD) d’Attijariwafa bank, a été une occasion pour détailler les avancées concrètes de la Zone de libre-échange continentale africaine (ZLECAf) aux 300 entreprises exportatrices participant ainsi que de débattre de la dynamisation du commerce régional. Intervenant dans ce sens, Cynthia Essonam-Gnassingbe, directrice de l’engagement du secteur privé au secrétariat général de la ZLECAf, a mis en avant les opportunités offertes par la Zone aux exportateurs marocains. Du côté de la Banque africaine de développement, Achraf Tarsim, directeur Maroc de la Banque, a souligné le rôle central des institutions financières dans l’accompagnement des exportations et des investissements marocains en Afrique. Cette rencontre a été marquée par l’organisation de deux panels de haut niveau. Le premier, introduit par Ismaïl Douiri, directeur général délégué en charge de la Banque de détail à l’international et des filiales de financement spécialisées du Groupe Attijariwafa bank, a permis de poser le cadre stratégique des enjeux de financement liés à la ZLECAf. Un second panel, consacré aux nouveaux mécanismes ainsi qu’aux modalités pratiques de sécurisation des investissements et des exportations, a également retenu l’attention de l’auditoire. En clôture du sommet, la vice-présidente et présidente de la commission Afrique de l’Asmex, Saloua Karkri Belkeziz, a salué le rythme soutenu de mise en œuvre de la ZLECAf. Elle a également partagé la vision d’avenir des exportateurs marocains au sein de leur environnement régional, dans un contexte international où la proximité géographique apparaît plus que jamais comme un levier de croissance. Il est à rappeler que cette rencontre d’envergure a rassemblé plusieurs hautes personnalités, parmi lesquelles Karim Zidane, ministre délégué chargé de l’investissement auprès du Chef du gouvernement, Omar Hejira, secrétaire d’État chargé du commerce extérieur, Mohamed El Kettani, président-directeur général du groupe Attijariwafa bank, ainsi que Kawtar Raji secrétaire générale de l’Asmex. Recevez les dernières actualités d’Aujourd’hui Le Maroc directement sur WhatsApp",direct:aujourdhui_search,36,0,2026-04-17T19:20:46.429608+00:00
2026-04-13T11:21:21+00:00,ATW,Attijariwafa bank : M.S.IN recommande le titre et vise 12% de hausse,Medias24,https://medias24.com/2026/04/13/attijariwafa-bank-m-s-in-recommande-le-titre-et-vise-12-de-hausse-1658655/,,direct:medias24_wp,83,1,2026-04-17T19:21:47.841440+00:00
2026-04-10,ATW,Attijariwafa bank : M.S.IN revoit sa valorisation à 787 dirhams et recommande de renforcer,Boursenews,https://boursenews.ma/article/marches/ATW-MSIN-passe-de-conserver-a-renforcer,,direct:boursenews_stock,69,1,2026-04-17T19:21:08.394039+00:00
2026-04-09,ATW,Attijariwafa Bank: BMCE Capital relève son cours cible et recommande le titre aux investisseurs,Boursenews,https://boursenews.ma/article/marches/Attijariwafa-bank-BMCE-Capital-releve-cours-cible,,direct:boursenews_stock,69,1,2026-04-17T19:21:08.394039+00:00
2026-03-07T11:50:15+00:00,ATW,"Noufissa Kessar, un leadership  au féminin pour une nouvelle ère",Aujourd'hui,https://aujourdhui.ma/societe/noufissa-kessar-un-leadership-au-feminin-pour-une-nouvelle-ere,"Nommée PDG du Groupe Al Mada en janvier dernier Engagement : Sa nomination à la tête d’Al Mada consacre un parcours interne marqué par la maîtrise des enjeux stratégiques et une capacité à conjuguer innovation et croissance durable. Nommée en janvier dernier en tant que présidente-directrice générale du Groupe Al Mada, Noufissa Kessar appartient à cette génération de dirigeantes formées à l’exigence académique internationale et aguerries aux réalités stratégiques des grands groupes. « La nomination de Mme Noufissa Kessar s’inscrit dans la continuité de l’engagement d’Al Mada en faveur de l’innovation, de la croissance durable et de l’excellence opérationnelle », avait affirmé le Groupe dans le communiqué annonçant la nomination de Mme Kessar. Diplômée de l’École Polytechnique Fédérale de Lausanne, la nouvelle PDG du groupe allie rigueur et culture de la performance, un socle qui a façonné l’ensemble de son parcours. C’est au sein du groupe Al Mada qu’elle construit l’essentiel de sa carrière. Elle débute à la banque du groupe, Attijariwafa bank, où elle participe notamment à la création d’Attijari Finances Corp, contribuant ainsi à l’élargissement des activités financières et à la structuration de nouveaux leviers de croissance. Cette première étape lui permet de maîtriser les dynamiques d’investissement, les enjeux de développement et les impératifs de compétitivité sur des marchés en mutation. Elle rejoint ensuite le holding en qualité de directrice générale adjointe. À ce poste, elle s’implique activement dans les projets stratégiques et accompagne le développement global du groupe, intervenant sur des dossiers structurants à forte dimension nationale et internationale. Elle consolide une vision transversale des métiers et des secteurs dans lesquels Al Mada est engagé. Noufissa Kessar incarne une continuité dans la transformation du groupe. Sa nomination à la tête d’Al Mada consacre un parcours interne marqué par la maîtrise des enjeux stratégiques et une capacité à conjuguer innovation et croissance durable. À travers elle, c’est le choix d’un leadership enraciné dans la culture du groupe et tourné vers l’avenir qui s’affirme. « Sous la direction de Mme Kessar, Al Mada consolidera le développement en cours, l’innovation et sa contribution au progrès économique et social du Maroc et à l’international, dans le respect des valeurs fixées par les actionnaires du Groupe», conclut le communiqué », avait assuré la même source. Recevez les dernières actualités d’Aujourd’hui Le Maroc directement sur WhatsApp",direct:aujourdhui_search,68,1,2026-04-17T19:20:46.429608+00:00
2026-03-05T11:46:02+00:00,ATW,Plus de 37 millions d'impayés : Attijariwafa bank fait condamner l'armateur Inter Shipping et son dirigeant,Medias24,https://medias24.com/2026/03/05/plus-de-37-millions-dimpayes-attijariwafa-bank-fait-condamner-larmateur-inter-shipping-et-son-dirigeant-1638143/,,direct:medias24_wp,51,0,2026-04-17T19:21:47.841440+00:00
2026-03-05T11:35:01+00:00,ATW,Ozone en redressement : un trio bancaire pour surveiller la gestion,Medias24,https://medias24.com/2026/03/05/ozone-en-redressement-un-trio-bancaire-pour-surveiller-la-gestion-1637997/,,direct:medias24_wp,36,0,2026-04-17T19:21:47.841440+00:00
2026-03-04T16:49:14+00:00,ATW,Banques. Comment le podium bancaire au Maroc a évolué en 2025,Medias24,https://medias24.com/2026/03/04/banques-comment-le-podium-bancaire-au-maroc-a-evolue-en-2025-1637453/,,direct:medias24_wp,44,0,2026-04-17T19:21:47.841440+00:00
2026-02-26T09:55:15+00:00,ATW,"Un PNB de près de 35 MMDH et un résultat net consolidé de 12,4 MMDH : Attijariwafa bank améliore sa rentabilité en 2025",Aujourd'hui,https://aujourdhui.ma/economie/un-pnb-de-pres-de-35-mmdh-et-un-resultat-net-consolide-de-124-mmdh-attijariwafa-bank-ameliore-sa-rentabilite-en-2025,"Le résultat d’exploitation du groupe s’est hissé à 18 milliards de dirhams, en progression de 10 %. Performance : Attijariwafa bank boucle l’exercice 2025 sur une performance solide, marquée par une progression de ses indicateurs. Les détails ! Attijariwafa bank affiche des résultats en forte croissance au titre de l’exercice 2025. Le bilan dressé confirme une amélioration continue de la rentabilité du Groupe. Ceci se traduit par une hausse de 5,6 % du produit net bancaire consolidé. Ce dernier s’est élevé à 34,9 milliards de dirhams. «Cette progression a été induite par la dynamique commerciale favorable, décrite ci-dessus, en termes de collecte de l’épargne et de financement de l’économie au Maroc et dans le reste des pays de présence», précise le Groupe dans sa communication financière. Le résultat d’exploitation du groupe s’est hissé à 18 milliards de dirhams, en progression de 10 %. Commentant cette évolution, Attijariwafa bank met en avant le repli de 13 % du coût du risque revenant à 3,7 milliards de dirhams représentant ainsi 0,77 % des encours clientèle à fin décembre 2025 contre 0,95 % en 2024. Le résultat net consolidé s’est apprécié de 14,4 % se situant autour de 12,4 milliards de dirhams contre 10,8 milliards de dirhams, une année auparavant. Par ailleurs, le résultat net part du groupe a atteint les 10,6 milliards de dirhams en amélioration de 16,2 %. Pour ce qui est de la solidité financière du Groupe, elle s’est renforcée avec des fonds propres consolidés de 80,5 milliards de dirhams contre 72,5 milliards de dirhams une année plus tôt marquant ainsi une progression de 11 %. Attijariwafa bank a renforcé durant l’année son engagement en termes de financement de l’économie réelle et d’accompagnement des ménages, des entreprises et des États dans les pays de présence. S’agissant du financement de l’investissement productif, le Groupe a alloué 125 milliards de dirhams des crédits à l’équipement en hausse de 42 %, captant ainsi 36 % des parts de marché. On relève également une progression de 8 % des crédits aux entreprises. Leur encours s’est élevé à 214 milliards de dirhams. Le Groupe a gagné ainsi 23 points de base raflant 30 % des parts de marché. Attijariwafa bank a par ailleurs produit 20 milliards de dirhams de crédits aux TPME et 9 milliards de dirhams de crédits aux ménages. Dans l’ensemble, Attijariwafa bank observe une forte progression des crédits à l’économie au Maroc. La hausse est estimée à 6 % représentant une production nette de 19 milliards de dirhams. Le groupe confirme dans ce sens sa position de leader avec une part de marché consolidée de 27,3 %.On relève également une poursuite de la dynamique de financement dans les pays de présence avec une croissance de 6 % des crédits à l’économie. Recevez les dernières actualités d’Aujourd’hui Le Maroc directement sur WhatsApp",direct:aujourdhui_search,100,1,2026-04-17T19:20:46.429608+00:00
2026-02-25,ATW,"Attijariwafa bank SA Reports Earnings Results for the Full Year Ended December 31, 2025",MarketScreener,https://www.marketscreener.com/news/attijariwafa-bank-sa-reports-earnings-results-for-the-full-year-ended-december-31-2025-ce7e5cd9dd81fe22,,direct:marketscreener_atw_news,69,1,2026-04-17T19:21:39.047206+00:00
2026-02-24,ATW,"Attijariwafa Bank : Les résultats bondissent de 16,2% en 2025",Boursenews,https://boursenews.ma/article/marches/ATW-resultats-2025,,direct:boursenews_stock,69,1,2026-04-17T19:21:08.394039+00:00
2026-02-20T09:59:40+00:00,ATW,Avec le programme «StayCashless» : Le Maroc accélère le virage cashless dans le tourisme,Aujourd'hui,https://aujourdhui.ma/economie/avec-le-programme-staycashless-le-maroc-accelere-le-virage-cashless-dans-le-tourisme,"L’offre proposée facilitera l’accès aux moyens de paiement électroniques, avec des conditions attractives, des commissions internationales revues à la baisse et des solutions modernes. Digitalisation : Le Maroc mise sur le paiement numérique pour séduire les touristes. Avec le lancement du programme «StayCashless», le ministère du tourisme, Attijariwafa bank et Visa simplifient les transactions pour les visiteurs et accompagnent les opérateurs locaux dans leur transformation digitale Le ministère du tourisme, de l’artisanat et de l’économie sociale et solidaire se joint au Groupe Attijariwafa bank et Visa pour mettre en place une initiative visant à simplifier l’expérience paiement du touriste tout au long de son parcours. Les trois parties ont signé, mercredi, un mémorandum d’entente pour le lancement officiel du programme « StayCashless », un accélérateur de la transformation digitale dans le secteur touristique. Ce dispositif garantit des solutions sécurisées et universellement acceptées, au service de la compétitivité des opérateurs. « Les 138 milliards de dirhams de recettes voyages en 2025 montrent que le Maroc dispose aujourd’hui d’une offre touristique attractive, pour laquelle les touristes sont prêts à payer. Mais les attentes évoluent et le paiement digital devient la norme. Aller vers le cashless à grande échelle n’est donc plus une option», assure Fatim-Zahra Ammor, ministre du tourisme, de l’artisanat et de l’économie sociale et solidaire. Et de préciser que «ce partenariat est une étape importante et nous appelons l’ensemble des parties prenantes à s’inscrire dans cette dynamique». Du côté d’Attijariwafa bank, le président du Groupe Mohamed El Kettani assure que le développement du tourisme constitue un enjeu stratégique pour l’économie nationale. «A travers ce partenariat, le Groupe Attijariwafa bank réaffirme son engagement à accompagner les secteurs clés du Royaume en mobilisant des solutions de paiement innovantes, inclusives et alignées avec les standards internationaux, au service de la compétitivité et de la croissance durable», indique-t-il. Pour sa part, Leila Serhan, Groupe Country Manager de Visa pour la région Afrique du Nord, le Levant et le Pakistan, souligne que «ce partenariat stratégique va bien au-delà d’une simple collaboration technique : il constitue un véritable levier de croissance, mobilisant la data et l’innovation pour contribuer à la digitalisation de l’ensemble de la chaîne de valeur du tourisme, des artisans et petits commerçants aux acteurs majeurs du secteur ». Et de poursuivre : « Le Maroc traverse aujourd’hui un moment charnière de son développement touristique. L’ambition fixée pour 2026, avec un objectif de 17,5 millions de visiteurs, a été dépassée dès 2024. En 2025, le Royaume a par ailleurs enregistré un niveau record, avec l’accueil de 20 millions de visiteurs. Chez Visa, nous sommes fiers d’accompagner cette dynamique en mettant à disposition une infrastructure de paiement de classe mondiale ». Partenaire technologique dudit programme, Visa proposera des solutions de paiements avancées et sécurisées pour soutenir les opérateurs locaux dans leur transformation digitale et accompagner la stratégie du Royaume vers une économie plus inclusive et connectée. Une convention opérationnelle entre la CNT et Attijari Payment Il est à noter que le programme «Stay Cashless » se concrétise également par la signature, le même jour, d’une convention entre la Confédération nationale du tourisme (CNT) et Attijari Payment. L’offre proposée facilitera l’accès aux moyens de paiement électroniques, avec des conditions attractives, des commissions internationales revues à la baisse et des solutions modernes telles que le pay-by-link, le tap-on-phone ou encore la conversion dynamique de devise. Pour la confédération, ce partenariat constitue un levier pragmatique pour renforcer l’efficacité de la compétitivité de ses membres. Son président, Hamid Bentahar, souligne : « Au-delà d’une solution de paiement, ce partenariat constitue un véritable dispositif d’accompagnement de nos membres vers la digitalisation. Il combine de nouvelles solutions plus adaptées, un programme de sensibilisation et formation pour permettre à l’ensemble des opérateurs, notamment les TPME, de monter en compétences, d’améliorer leurs services et d’offrir une expérience plus fluide et rassurante aux visiteurs », explique Hamid Bentahar, président de la CNT. Au cœur de cette mise en œuvre, Attijari Payment contribue à la déclinaison opérationnelle de la stratégie à travers des solutions concrètes. Son directeur général Fahd Bettache précise : « Nous accompagnons les opérateurs touristiques dans l’adoption du paiement électronique, en garantissant des solutions sécurisées, conformes et adaptées aux réalités du secteur. L’objectif est d’en faire un véritable levier de performance et d’amélioration de l’expérience client ». Un plan d’action d’accompa-gnement et un dispositif de communication dans le pipe Afin d’assurer une mise en œuvre rapide du mémorandum d’entente et la convention opérationnelle, les parties prenantes engageront dès les prochains jours le déploiement opérationnel d’un plan d’action d’accompagnement à la digitalisation des opérateurs touristiques, avec la mise à disposition de solutions de paiement électronique adaptées, en particulier au profit des TPME touristiques. Il sera également procédé à la mise en place d’un dispositif structuré de communication, de sensibilisation et de formation. Le but étant d’accélérer l’adhésion des professionnels et de favoriser l’adoption à grande échelle du paiement digital dans l’ensemble du secteur. Cette dynamique s’inscrit dans une vision plus large d’amélioration continue de l’expérience des visiteurs et des services mis à la disposition de l’écosystème touristique. Recevez les dernières actualités d’Aujourd’hui Le Maroc directement sur WhatsApp",direct:aujourdhui_search,68,1,2026-04-17T19:20:46.429608+00:00
2026-02-19T15:42:17+00:00,ATW,Univers Acier condamné à près de 67 MDH au profit d'Attijariwafa bank,Medias24,https://medias24.com/2026/02/19/univers-acier-condamne-a-pres-de-67-mdh-au-profit-dattijariwafa-bank-1631023/,,direct:medias24_wp,69,1,2026-04-17T19:21:47.841440+00:00
2026-02-11T09:21:09+00:00,ATW,"Banques intermédiaires en valeurs du Trésor : Attijariwafa bank, BMCE Capital et BCP en tête  du podium en 2025",Aujourd'hui,https://aujourdhui.ma/economie/banques-intermediaires-en-valeurs-du-tresor-attijariwafa-bank-bmce-capital-et-bcp-en-tete-du-podium-en-2025,"Classement  : Attijariwafa bank, BMCE Capital et la Banque Centrale Populaire (BCP) occupent les trois premières places dans le classement annuel des banques intermédiaires en valeurs du Trésor (IVT) les plus actives sur le marché des bons du Trésor au titre de l’année 2025, a annoncé, récemment, le ministère de l’économie et des finances. «Conformément aux dispositions des conventions conclues entre la Direction du Trésor et des finances extérieures (DTFE) et les banques IVT, cette direction procède à la publication du classement annuel des trois banques IVT les plus actives sur le marché des valeurs du Trésor», indique le ministère de l’économie et des finances. Et d’ajouter : «En effet, l’établissement de ce classement repose sur une analyse des performances des banques IVT». Dans les détails, l’évaluation porte sur la qualité d’animation des marchés primaire et secondaire des bons du Trésor, la participation aux opérations de gestion active de la dette intérieure ainsi que le respect des engagements de cotation électronique des bons du Trésor. Cette évaluation intègre également la qualité du conseil fourni et la pertinence des informations communiquées à la direction. Recevez les dernières actualités d’Aujourd’hui Le Maroc directement sur WhatsApp",direct:aujourdhui_search,51,0,2026-04-17T19:20:46.429608+00:00
2026-01-16T10:00:46+00:00,ATW,Al Mada annonce la nomination de Mme Noufissa Kessar en tant que Présidente-Directrice Générale,Aujourd'hui,https://aujourdhui.ma/actualite/al-mada-annonce-la-nomination-de-mme-noufissa-kessar-en-tant-que-presidente-directrice-generale,"Suite au décès de M.Hassan Ouriagli, Président Directeur Général d’Al Mada , Le Conseil d’administration, réuni ce jour, lui a rendu hommage pour son leadership, ses nombreuses réalisations et son dévouement exemplaire au service du groupe. Son engagement a marqué l’histoire d’Al Mada et a fortement contribué à sa position stratégique dans l’économie nationale et Africaine. Al Mada adresse ses plus sincères condoléances à la famille de M. Hassan Ouriagli, ainsi qu’à l’ensemble des collaborateurs du groupe, partageant leur peine en ce moment de profonde émotion. Le Conseil d’administration d’Al Mada a, par ailleurs, décidé de nommer Mme Noufissa Kessar au poste de Présidente-Directrice Générale du groupe, avec effet immédiat. Mme Kessar a construit sa carrière au sein du groupe, d’abord au sein de la banque du groupe, puis au holding Al Mada en qualité de Directrice Générale Adjointe, où elle a contribué activement aux projets stratégiques et au développement global du groupe. Mme Noufissa Kessar est diplômée de l’école Polytechnique Fédérale de Lausanne. Elle a fait l’essentiel de sa carrière au sein du Groupe Al Mada d’abord au sein d’Attijariwafa Bank où elle a entre autres participé à la création d’Attijari Finances Corp et ce, avant de rejoindre le Holding. Mme Noufissa Kessar est également administratrice dans certaines filiales du Groupe Al Mada. Sa nomination s’inscrit dans la continuité de l’engagement d’Al Mada en faveur de l’innovation, de la croissance durable et de l’excellence opérationnelle. Sous la direction de Mme Noufissa Kessar, Al Mada consolidera le développement en cours, l’innovation et sa contribution au progrès économique et social du Maroc et à l’international, dans le respect des valeurs fixées par les actionnaires du Groupe Al Mada. Recevez les dernières actualités d’Aujourd’hui Le Maroc directement sur WhatsApp",direct:aujourdhui_search,44,0,2026-04-17T19:20:46.429608+00:00
2026-01-08T16:37:26+00:00,ATW,"Affaire Abroun : les banques mises à l’épreuve, jugements au cas par cas",Medias24,https://medias24.com/2026/01/08/affaire-abroun-les-banques-mises-a-lepreuve-jugements-au-cas-par-cas-1608673/,,direct:medias24_wp,44,0,2026-04-17T19:21:47.841440+00:00
2026-01-06T13:09:20+00:00,ATW,"En liquidation, Abroun fait condamner BMCI pour faute bancaire",Medias24,https://medias24.com/2026/01/06/en-liquidation-abroun-fait-condamner-bmci-pour-faute-bancaire-1607101/,,direct:medias24_wp,24,0,2026-04-17T19:21:47.841440+00:00
2026-01-05T13:41:31+00:00,ATW,Delattre Levivier Maroc : la créance AWB admise à titre privilégié,Medias24,https://medias24.com/2026/01/05/delattre-levivier-maroc-la-creance-awb-admise-a-titre-privilegie-1606415/,,direct:medias24_wp,36,0,2026-04-17T19:21:47.841440+00:00
